{
  "schema_version": "1.0",
  "task_id": "tidymodels_yardstick_615",
  "task_type": "swe",
  "difficulty": "easy",
  "instruction": "Fix the bug in brier_class() where the function returns NaN when using extreme values of case_weights. The issue occurs in the brier_ind() function in R/prob-brier_class.R where exp(case_weights) produces Inf for large weight values, causing NaN results. The function should produce identical results regardless of the scale of case weights (e.g., weights of 1 vs weights of 5000 should give the same result).",
  "context": "The brier_ind() function normalizes case weights using: case_weights <- exp(case_weights) / sum(exp(case_weights)). When case_weights contain large values (e.g., 5000), exp(5000) returns Inf, causing the normalization to produce NaN. This is a numerical overflow issue that can be solved using the standard log-sum-exp trick for numerical stability.",
  "hints": [],
  "source_package": "yardstick",
  "source_file": null,
  "tests": {
    "fail_to_pass": [
      "Test that brier_class_vec() with case_weights of 5000 produces identical results to case_weights of 1 (not NaN)"
    ],
    "pass_to_pass": [
      "Existing brier_class tests for basic functionality",
      "Existing tests for range values",
      "Tests with normal case weights values"
    ],
    "test_files": []
  },
  "solution": {
    "key_changes": [
      "Subtract max(case_weights) from all weights before applying exp() to avoid overflow",
      "The mathematical identity: exp(x - max(x)) / sum(exp(x - max(x))) = exp(x) / sum(exp(x))",
      "This is the standard log-sum-exp trick for numerical stability"
    ],
    "potential_pitfalls": [
      "Must ensure the subtraction happens before exp() is called",
      "The fix should not change the mathematical result, only improve numerical stability",
      "Need to handle edge cases like all weights being equal or single observation"
    ],
    "reference_diff": "diff --git a/NEWS.md b/NEWS.md\nindex cbae4120..cfd88a63 100644\n--- a/NEWS.md\n+++ b/NEWS.md\n@@ -18,6 +18,8 @@\n \n * The ranked probability score for ordinal classification data was added with `ranked_prob_score()`. (#524)\n \n+* Fixed bug where `brier_class()` returns NaN with extreme value case weights. (#614)\n+\n * `poisson_log_loss()` has been enhanced to handle 0 valued estimates, no longer returning `Inf` or `NaN`. (#513)\n \n * Fixed bug where ranked probability metrics didn't work in combination with other classification metrics in `metric_set()`. (#539)\ndiff --git a/R/prob-brier_class.R b/R/prob-brier_class.R\nindex 5d0a5125..e06c5bce 100644\n--- a/R/prob-brier_class.R\n+++ b/R/prob-brier_class.R\n@@ -160,6 +160,11 @@ brier_ind <- function(truth, estimate, case_weights = NULL) {\n   case_weights <- case_weights[not_missing]\n \n   # Normalize weights (in case negative weights)\n+  # subtracting max to avoid Inf in calculations\n+  #  exp(x - max(x)) / sum(exp(x - max(x)))\n+  #  = (exp(x) / exp(max(x))) / (sum(exp(x)) / exp(max(x)))\n+  #  = exp(x) / sum(exp(x))\n+  case_weights <- case_weights - max(case_weights)\n   case_weights <- exp(case_weights) / sum(exp(case_weights))\n \n   res <- sum(resids * case_weights) / (2 * sum(case_weights))"
  },
  "source": {
    "type": "github_pr",
    "repo": "tidymodels/yardstick",
    "pr_number": 615,
    "pr_url": "https://github.com/tidymodels/yardstick/pull/615",
    "merged_at": "2026-01-27T20:02:50+00:00",
    "issue_number": null,
    "issue_url": "https://github.com/tidymodels/yardstick/issues/614"
  },
  "files": {
    "changed": [],
    "source_files": [],
    "test_changes": null
  },
  "quality_score": 8.0,
  "split": "mined",
  "dependencies": [],
  "constraints": {},
  "created_at": "2026-02-22T19:02:23.825579+00:00",
  "updated_at": null
}