{
  "schema_version": "1.0",
  "task_id": "rstudio_renv_2200",
  "task_type": "swe",
  "difficulty": "medium",
  "instruction": "Implement support for multiple named repositories in the `RENV_CONFIG_REPOS_OVERRIDE` environment variable. The function `renv_bootstrap_repos()` in R/bootstrap.R should parse the environment variable to support: (1) a single unnamed URL which gets named 'CRAN', and (2) multiple named repositories in the format `NAME1=URL1;NAME2=URL2` where repositories are semicolon-delimited. The same logic must also be implemented in inst/resources/activate.R which contains a parallel implementation for the activation script.",
  "context": "The renv_bootstrap_repos() function currently reads RENV_CONFIG_REPOS_OVERRIDE and returns it as-is. The new implementation should:\n\n1. Split the value on ';' to get individual repo specifications\n2. For each part, split on the first '=' to get NAME=URL\n3. If a single unnamed URL is provided (no '='), name it 'CRAN'\n4. Return a named character vector of repositories\n\nKey function signature:\nr\nrenv_bootstrap_repos <- function() {\n  repos <- Sys.getenv(\"RENV_CONFIG_REPOS_OVERRIDE\", unset = NA)\n  # ... parsing logic ...\n  return(vals)  # named character vector\n}\n",
  "hints": [],
  "source_package": "renv",
  "source_file": null,
  "tests": {
    "fail_to_pass": [
      "repos override supports unnamed repo - single URL should be named CRAN",
      "repos override can use 1 named repository - NAME=URL format works",
      "repos override can use 2+ named repositories - semicolon-delimited NAME=URL pairs work",
      "repos override can handle `=` in repo urls - URLs with query parameters containing = are parsed correctly",
      "repos override handle paths - URLs with path separators work correctly"
    ],
    "pass_to_pass": [
      "Existing bootstrap version validation tests continue to pass",
      "Other bootstrap repository resolution logic remains unchanged when RENV_CONFIG_REPOS_OVERRIDE is not set"
    ],
    "test_files": []
  },
  "solution": {
    "key_changes": [
      "Split RENV_CONFIG_REPOS_OVERRIDE value on ';' using strsplit()",
      "Use regexpr() with fixed=TRUE to find first '=' in each part",
      "Use substring() to extract name (before '=') and URL (after '=')",
      "Assign names to the values vector using names(vals) <- keys",
      "Handle edge case: single unnamed URL should be named 'CRAN'",
      "Apply same changes to both R/bootstrap.R and inst/resources/activate.R"
    ],
    "potential_pitfalls": [
      "Using strsplit() on '=' would fail for URLs containing '=' in query parameters - must use regexpr() to find only the first '='",
      "Forgetting to handle the single unnamed URL case (should default to 'CRAN')",
      "Not updating both R/bootstrap.R and inst/resources/activate.R (they contain parallel implementations)",
      "Empty keys when no '=' is present - need to check with identical(keys, \"\")"
    ],
    "reference_diff": "diff --git a/NEWS.md b/NEWS.md\nindex a3f071eea..e25c50d5e 100644\n--- a/NEWS.md\n+++ b/NEWS.md\n@@ -1,6 +1,10 @@\n \n # renv (development version)\n \n+* `RENV_CONFIG_REPOS_OVERRIDE` now supports multiple named repositories using\n+  the syntax `NAME1=URL1;NAME2=URL2`. Single repository URLs continue to be\n+  supported.\n+\n * Fixed an issue where `renv::sysreqs()` could fail on operating systems\n   which don't declare a VERSION_ID in `/etc/os-release`. (#2197)\n \ndiff --git a/R/bootstrap.R b/R/bootstrap.R\nindex b3aaaca97..f602514e4 100644\n--- a/R/bootstrap.R\n+++ b/R/bootstrap.R\n@@ -107,12 +107,20 @@ renv_bootstrap_repos <- function() {\n   repos <- Sys.getenv(\"RENV_CONFIG_REPOS_OVERRIDE\", unset = NA)\n   if (!is.na(repos)) {\n \n-    # check for RSPM; if set, use a fallback repository for renv\n-    rspm <- Sys.getenv(\"RSPM\", unset = NA)\n-    if (identical(rspm, repos))\n-      repos <- c(RSPM = rspm, CRAN = cran)\n+    # split on ';' if present\n+    parts <- strsplit(repos, \";\", fixed = TRUE)[[1L]]\n \n-    return(repos)\n+    # split into named repositories if present\n+    idx <- regexpr(\"=\", parts, fixed = TRUE)\n+    keys <- substring(parts, 1L, idx - 1L)\n+    vals <- substring(parts, idx + 1L)\n+    names(vals) <- keys\n+\n+    # if we have a single unnamed repository, call it CRAN\n+    if (length(vals) == 1L && identical(keys, \"\"))\n+      names(vals) <- \"CRAN\"\n+\n+    return(vals)\n \n   }\n \ndiff --git a/inst/config.yml b/inst/config.yml\nindex fcf459c80..af863fd15 100644\n--- a/inst/config.yml\n+++ b/inst/config.yml\n@@ -268,6 +268,10 @@\n     the usage of some set of repositories over what is defined in `renv.lock` or otherwise\n     set by the R session.\n \n+    This can be specified as a single repository URL (e.g., \"https://cloud.r-project.org\"),\n+    or as multiple named repositories separated by semicolons using the format\n+    NAME=URL (e.g., \"CRAN=https://p3m.dev/cran/latest;R_UNIV=https://posit-dev.r-universe.dev\").\n+\n - name: \"rspm.enabled\"\n   type: \"logical[1]\"\n   default: true\ndiff --git a/inst/resources/activate.R b/inst/resources/activate.R\nindex 8b13aae8a..18d73e189 100644\n--- a/inst/resources/activate.R\n+++ b/inst/resources/activate.R\n@@ -266,14 +266,22 @@ local({\n     # check for repos override\n     repos <- Sys.getenv(\"RENV_CONFIG_REPOS_OVERRIDE\", unset = NA)\n     if (!is.na(repos)) {\n-  \n-      # check for RSPM; if set, use a fallback repository for renv\n-      rspm <- Sys.getenv(\"RSPM\", unset = NA)\n-      if (identical(rspm, repos))\n-        repos <- c(RSPM = rspm, CRAN = cran)\n-  \n-      return(repos)\n-  \n+\n+      # split on ';' if present\n+      parts <- strsplit(repos, \";\", fixed = TRUE)[[1L]]\n+\n+      # split into named repositories if present\n+      idx <- regexpr(\"=\", parts, fixed = TRUE)\n+      keys <- substring(parts, 1L, idx - 1L)\n+      vals <- substring(parts, idx + 1L)\n+      names(vals) <- keys\n+\n+      # if we have a single unnamed repository, call it CRAN\n+      if (length(vals) == 1L && identical(keys, \"\"))\n+        names(vals) <- \"CRAN\"\n+\n+      return(vals)\n+\n     }\n   \n     # check for lockfile repositories"
  },
  "source": {
    "type": "github_pr",
    "repo": "rstudio/renv",
    "pr_number": 2200,
    "pr_url": "https://github.com/rstudio/renv/pull/2200",
    "merged_at": "2026-01-06T17:01:25+00:00",
    "issue_number": null,
    "issue_url": "https://github.com/rstudio/renv/issues/716"
  },
  "files": {
    "changed": [],
    "source_files": [],
    "test_changes": null
  },
  "quality_score": 8.0,
  "split": "mined",
  "dependencies": [],
  "constraints": {},
  "created_at": "2026-02-22T19:11:52.231834+00:00",
  "updated_at": null
}