{
  "schema_version": "1.0",
  "task_id": "r-lib_vctrs_2135",
  "task_type": "swe",
  "difficulty": "medium",
  "instruction": "Fix the error message in `vec_default_ptype2()` that incorrectly reports `vctrs:::common_class_fallback` instead of the original class name when combining incompatible fallback objects at positions >= 3. When `vec_c()` or `list_unchop()` combine objects with custom classes that don't have vctrs methods, and an incompatibility occurs after a common class fallback has been computed, the error message should show the original class name (e.g., `vctrs_foobar`) rather than the internal `vctrs:::common_class_fallback` class.",
  "context": "The `vec_default_ptype2()` function in R/type2.R handles type coercion when no vctrs methods are defined for custom classes. When objects have a common class but incompatible attributes (like different typeof), a `common_class_fallback` object is created internally. Before throwing an error about incompatibility, the function should restore the original class for clearer error messages.\n\nRelated functions:\n- `is_common_class_fallback(x)` - checks if x is a common class fallback object\n- `fallback_class(x)` - gets the fallback class attribute\n- The fix should be added in `vec_default_ptype2()` before the error is thrown",
  "hints": [],
  "source_package": "vctrs",
  "source_file": null,
  "tests": {
    "fail_to_pass": [
      "Error message for `vec_c(foobar(1:2), foobar(5L), foobar(0))` should show `<vctrs_foobar>` not `<vctrs:::common_class_fallback>`",
      "Error message for `list_unchop()` with incompatible default should show original class name",
      "Error message for combining 2 incompatible fallback objects should show original class names"
    ],
    "pass_to_pass": [
      "vec_c() with compatible fallback objects should still work correctly",
      "list_combine() with compatible elements should still work correctly",
      "Existing error messages for other incompatibility cases should remain unchanged"
    ],
    "test_files": []
  },
  "solution": {
    "key_changes": [
      "Add a check in `vec_default_ptype2()` before throwing error: if `opts$s3_fallback` is true, check if x or y is a common_class_fallback and restore original class",
      "Create a `fallback_class_remove()` helper function that restores the original class from the `fallback_class` attribute",
      "The fix should be placed after the early return for successful ptype2 and before the error is thrown"
    ],
    "potential_pitfalls": [
      "Must only apply this transformation when `opts$s3_fallback` is TRUE",
      "The `fallback_class` attribute stores the original class - need to restore it and remove the attribute",
      "Both x and y might need to be transformed, not just one",
      "Should not modify the objects if they are not common class fallback objects"
    ],
    "reference_diff": "diff --git a/R/type2.R b/R/type2.R\nindex 203e423d5..308d1a0eb 100644\n--- a/R/type2.R\n+++ b/R/type2.R\n@@ -161,6 +161,16 @@ vec_default_ptype2 <- function(\n     return(vec_ptype(x, x_arg = x_arg))\n   }\n \n+  if (opts$s3_fallback) {\n+    # Undo common class fallback class for error messages\n+    if (is_common_class_fallback(x)) {\n+      x <- fallback_class_remove(x)\n+    }\n+    if (is_common_class_fallback(y)) {\n+      y <- fallback_class_remove(y)\n+    }\n+  }\n+\n   # The from-dispatch parameter is set only when called from our S3\n   # dispatch mechanism, when no method is found to dispatch to. It\n   # indicates whether the error message should provide advice about\n@@ -277,6 +287,11 @@ fallback_class <- function(x) {\n     class(x)\n   }\n }\n+fallback_class_remove <- function(x) {\n+  class(x) <- attr(x, \"fallback_class\", exact = TRUE)\n+  attr(x, \"fallback_class\") <- NULL\n+  x\n+}\n \n check_ptype2_dots_empty <- function(\n   ...,"
  },
  "source": {
    "type": "github_pr",
    "repo": "r-lib/vctrs",
    "pr_number": 2135,
    "pr_url": "https://github.com/r-lib/vctrs/pull/2135",
    "merged_at": "2026-01-06T01:35:08+00:00",
    "issue_number": null,
    "issue_url": "https://github.com/r-lib/vctrs/issues/1981"
  },
  "files": {
    "changed": [],
    "source_files": [],
    "test_changes": null
  },
  "quality_score": 8.0,
  "split": "mined",
  "dependencies": [],
  "constraints": {},
  "created_at": "2026-02-22T18:54:22.398371+00:00",
  "updated_at": null
}