{
  "schema_version": "1.0",
  "task_id": "tidymodels_parsnip_1326",
  "task_type": "swe",
  "difficulty": "easy",
  "instruction": "Fix the bug where quantile levels are dropped when modifying a model specification. When a user sets quantile levels via `set_mode('quantile regression', quantile_levels = ...)`, these levels should be retained when subsequently calling `set_engine()` or other model spec modification functions. Currently, the order of operations matters: `set_mode() |> set_engine()` loses quantile levels, while `set_engine() |> set_mode()` preserves them. The fix requires ensuring that `quantile_levels` is passed through when creating new model spec objects in the constructor functions.",
  "context": "The parsnip package uses a model specification object that contains various fields including `quantile_levels`. When functions like `set_engine()`, `set_args()`, and `update()` modify a spec, they create a new spec object via `new_model_spec()`. The bug occurs because `quantile_levels` is not being passed from the original object to the new one.\n\nKey function signature from R/misc.R:\nr\nnew_model_spec <- function(\n  ...,\n  user_specified_mode = TRUE,\n  method,\n  engine,\n  user_specified_engine = TRUE,\n  quantile_levels = NULL\n)\n\n\nThe fix involves adding `quantile_levels = object$quantile_levels` to the constructor calls in `set_args.model_spec()`, `set_engine.model_spec()`, and `update_spec()`.",
  "hints": [],
  "source_package": "parsnip",
  "source_file": null,
  "tests": {
    "fail_to_pass": [
      "quantile levels are retained when set_mode() is called before set_engine()",
      "quantile levels are retained when set_engine() is called before set_mode()",
      "quantile levels are retained when update() is called on a spec with quantile levels",
      "quantile levels remain NULL when not set"
    ],
    "pass_to_pass": [
      "basic model spec creation works correctly",
      "set_engine() works correctly for models without quantile levels",
      "set_mode() works correctly for modes other than quantile regression"
    ],
    "test_files": []
  },
  "solution": {
    "key_changes": [
      "Add `quantile_levels = object$quantile_levels` parameter to the new_model_spec() call in set_args.model_spec() (R/arguments.R)",
      "Add `quantile_levels = object$quantile_levels` parameter to the new_model_spec() call in set_engine.model_spec() (R/engines.R)",
      "Add `quantile_levels = object$quantile_levels` parameter to the new_model_spec() call in update_spec() (R/update.R)",
      "Add `quantile_levels = NULL` as a default parameter to new_model_spec() function definition (R/misc.R)"
    ],
    "potential_pitfalls": [
      "Forgetting to update all locations where new_model_spec() is called",
      "Not handling the NULL case correctly (when quantile_levels haven't been set)",
      "Missing the update_spec() function which also needs the fix"
    ],
    "reference_diff": "diff --git a/DESCRIPTION b/DESCRIPTION\nindex 286951677..2380f5f6b 100644\n--- a/DESCRIPTION\n+++ b/DESCRIPTION\n@@ -1,6 +1,6 @@\n Package: parsnip\n Title: A Common API to Modeling and Analysis Functions\n-Version: 1.4.1.9001\n+Version: 1.4.1.9002\n Authors@R: c(\n     person(\"Max\", \"Kuhn\", , \"max@posit.co\", role = c(\"cre\", \"aut\"),\n            comment = c(ORCID = \"0000-0003-2402-136X\")),\ndiff --git a/NEWS.md b/NEWS.md\nindex d383c2521..3def0085e 100644\n--- a/NEWS.md\n+++ b/NEWS.md\n@@ -1,5 +1,6 @@\n # parsnip (development version)\n \n+* Quantile levels are not dropped when a model specification is modified (#1304)\n \n * xgboost and qrnn engines were added for quantile regression to `boost_tree()` and `mlp()`, respectively. (#1321)\n \ndiff --git a/R/arguments.R b/R/arguments.R\nindex df67ac8dd..0518a0d18 100644\n--- a/R/arguments.R\n+++ b/R/arguments.R\n@@ -81,7 +81,8 @@ set_args.model_spec <- function(object, ...) {\n     user_specified_mode = object$user_specified_mode,\n     method = NULL,\n     engine = object$engine,\n-    user_specified_engine = object$user_specified_engine\n+    user_specified_engine = object$user_specified_engine,\n+    quantile_levels = object$quantile_levels\n   )\n }\n \ndiff --git a/R/engines.R b/R/engines.R\nindex 906a09ccc..ba9ade978 100644\n--- a/R/engines.R\n+++ b/R/engines.R\n@@ -145,7 +145,8 @@ set_engine.model_spec <- function(object, engine, ...) {\n     user_specified_mode = object$user_specified_mode,\n     method = NULL,\n     engine = object$engine,\n-    user_specified_engine = TRUE\n+    user_specified_engine = TRUE,\n+    quantile_levels = object$quantile_levels\n   )\n }\n \ndiff --git a/R/misc.R b/R/misc.R\nindex 1d79ec16e..40418ba40 100644\n--- a/R/misc.R\n+++ b/R/misc.R\n@@ -374,7 +374,8 @@ new_model_spec <- function(\n   user_specified_mode = TRUE,\n   method,\n   engine,\n-  user_specified_engine = TRUE\n+  user_specified_engine = TRUE,\n+  quantile_levels = NULL\n ) {\n   # determine if the model specification could feasibly match any entry\n   # in the union of the parsnip model environment and model_info_table.\n@@ -386,7 +387,8 @@ new_model_spec <- function(\n     user_specified_mode = user_specified_mode,\n     method = method,\n     engine = engine,\n-    user_specified_engine = user_specified_engine\n+    user_specified_engine = user_specified_engine,\n+    quantile_levels = quantile_levels\n   )\n   class(out) <- make_classes(cls)\n \ndiff --git a/R/update.R b/R/update.R\nindex 9760ded0e..fbdf6ea71 100644\n--- a/R/update.R\n+++ b/R/update.R\n@@ -100,6 +100,7 @@ update_spec <- function(\n     user_specified_mode = object$user_specified_mode,\n     method = NULL,\n     engine = object$engine,\n-    user_specified_engine = object$user_specified_engine\n+    user_specified_engine = object$user_specified_engine,\n+    quantile_levels = object$quantile_levels\n   )\n }\ndiff --git a/man/add_on_exports.Rd b/man/add_on_exports.Rd\nindex 09c3434fb..75a8eeddc 100644\n--- a/man/add_on_exports.Rd\n+++ b/man/add_on_exports.Rd\n@@ -31,7 +31,8 @@ new_model_spec(\n   user_specified_mode = TRUE,\n   method,\n   engine,\n-  user_specified_engine = TRUE\n+  user_specified_engine = TRUE,\n+  quantile_levels = NULL\n )\n \n check_final_param(x, call = rlang::caller_env())"
  },
  "source": {
    "type": "github_pr",
    "repo": "tidymodels/parsnip",
    "pr_number": 1326,
    "pr_url": "https://github.com/tidymodels/parsnip/pull/1326",
    "merged_at": "2026-01-30T13:43:51+00:00",
    "issue_number": null,
    "issue_url": "https://github.com/tidymodels/parsnip/issues/1304"
  },
  "files": {
    "changed": [],
    "source_files": [],
    "test_changes": null
  },
  "quality_score": 8.0,
  "split": "mined",
  "dependencies": [],
  "constraints": {},
  "created_at": "2026-02-22T18:38:38.100201+00:00",
  "updated_at": null
}