{
  "schema_version": "1.0",
  "task_id": "rstudio_plumber_977",
  "task_type": "swe",
  "difficulty": "medium",
  "instruction": "Fix the bug in plumber where the `apiPath` option is not being used when mounting the documentation router. When `options_plumber(apiPath = \"/x\")` is set, the docs should be served at `/x/__docs__/` instead of `/__docs__/`. The `apiPath` option should be respected in: (1) `mount_openapi()` for the OpenAPI JSON endpoint path, (2) `unmount_openapi()` for removing the endpoint, (3) `register_docs()` for mounting the docs router, and (4) `swagger_redirects()` for legacy redirect paths. Use `get_option_or_env(\"plumber.apiPath\", \"\")` to retrieve the configured path.",
  "context": "The plumber package uses R6 classes for its router. Key functions involved:\n- `mount_openapi(pr, api_url)`: Mounts OpenAPI JSON spec endpoint\n- `unmount_openapi(pr)`: Removes OpenAPI endpoint\n- `register_docs(name, index, static)`: Registers documentation UI\n- `swagger_redirects()`: Returns legacy redirect mappings\n- `get_option_or_env(name, default)`: Retrieves option from R options or environment variable\n\nThe docs are mounted at `/__docs__/` by default. The `plumber.apiPath` option should prefix this path.",
  "hints": [],
  "source_package": "plumber",
  "source_file": null,
  "tests": {
    "fail_to_pass": [
      "mount_openapi uses plumber.apiPath when set - endpoint should be at /api/v1/openapi. when apiPath='/api/v1'",
      "mount_openapi works with nested apiPath - endpoint at /api/v2/myapp/openapi. when apiPath='/api/v2/myapp'",
      "unmount_openapi uses plumber.apiPath when set - should remove endpoint at prefixed path",
      "register_docs respects plumber.apiPath option - docs mounted at /api/v1/__docs__/ not /__docs__/",
      "swagger_redirects respects plumber.apiPath option - redirects point to prefixed docs path",
      "mount_docs integrates openapi and docs paths correctly with apiPath",
      "apiPath works with environment variable PLUMBER_APIPATH"
    ],
    "pass_to_pass": [
      "mount_openapi respects default (empty) apiPath - endpoint at /openapi.",
      "unmount_openapi works with default apiPath",
      "register_docs mounts at /__docs__/ by default",
      "swagger_redirects returns correct default paths",
      "empty apiPath works correctly - behaves like default"
    ],
    "test_files": []
  },
  "solution": {
    "key_changes": [
      "In mount_openapi(): construct openapi__path using apiPath: paste0(get_option_or_env(\"plumber.apiPath\", \"\"), \"/openapi.\")",
      "In unmount_openapi(): use apiPath when calling pr$removeHandle()",
      "In register_docs(): prefix docs_root with apiPath when calling pr$mount()",
      "In swagger_redirects(): include apiPath in redirect target routes"
    ],
    "potential_pitfalls": [
      "Forgetting to handle the default empty string case for apiPath",
      "Not updating both mount_openapi AND unmount_openapi consistently",
      "Missing the swagger_redirects function which also needs the apiPath",
      "Double slashes when apiPath has trailing slash (e.g., '/api/v1/' + '/openapi.' = '/api/v1//openapi.')",
      "Not using get_option_or_env() which checks both R options and environment variables"
    ],
    "reference_diff": "diff --git a/.Rbuildignore b/.Rbuildignore\nindex 88555bae6..c54c0d386 100644\n--- a/.Rbuildignore\n+++ b/.Rbuildignore\n@@ -28,3 +28,4 @@ rsconnect\n ^codecov\\.yml$\n ^CRAN-SUBMISSION$\n ^.claude$\n+^CLAUDE.md$\ndiff --git a/DESCRIPTION b/DESCRIPTION\nindex 67e82f438..d08c58921 100644\n--- a/DESCRIPTION\n+++ b/DESCRIPTION\n@@ -54,6 +54,7 @@ Suggests:\n     testthat (>= 0.11.0),\n     utils,\n     visNetwork,\n+    withr,\n     writexl,\n     yaml\n ByteCompile: TRUE\ndiff --git a/NEWS.md b/NEWS.md\nindex cfb246f5f..094a72aa8 100644\n--- a/NEWS.md\n+++ b/NEWS.md\n@@ -1,7 +1,7 @@\n # plumber (development version)\n \n * Added support for [Arrow IPC Streams](https://arrow.apache.org/docs/format/Columnar.html#serialization-and-interprocess-communication-ipc) (@josiahparry #968)\n-\n+* Fixed a bug where setting the `apiPath` option wouldn't be honored when running the app (@thomasp85, #836)\n * Removed deprecated `mockery` package dependency. Tests now use native R closures for callback tracking. (#1009)\n \n # plumber 1.3.0\ndiff --git a/R/plumb.R b/R/plumb.R\nindex ed7f03db6..514bc52da 100644\n--- a/R/plumb.R\n+++ b/R/plumb.R\n@@ -250,9 +250,18 @@ all_available_apis <- function() {\n     }\n   }\n \n-  # do not check for size 0, as plumber contains apis.\n-\n-  apis <- do.call(rbind, ret)\n+  if (length(ret) == 0) {\n+    # No APIs found, return empty data frame with correct structure\n+    apis <- data.frame(\n+      package = character(0),\n+      name = character(0),\n+      source_directory = character(0),\n+      stringsAsFactors = FALSE\n+    )\n+    class(apis) <- c(\"plumber_available_apis\", class(apis))\n+  } else {\n+    apis <- do.call(rbind, ret)\n+  }\n \n   list(\n     apis = apis, # will maintain class\ndiff --git a/R/plumber.R b/R/plumber.R\nindex a6d8460ca..1ad721cca 100644\n--- a/R/plumber.R\n+++ b/R/plumber.R\n@@ -253,7 +253,6 @@ Plumber <- R6Class(\n         old_wd <- setwd(dirname(private$filename))\n         on.exit({setwd(old_wd)}, add = TRUE)\n       }\n-\n       if (isTRUE(docs_info$enabled)) {\n         mount_docs(\n           pr = self,\n@@ -263,7 +262,7 @@ Plumber <- R6Class(\n           callback = swaggerCallback,\n           quiet = quiet\n         )\n-        on.exit(unmount_docs(self, docs_info), add = TRUE)\n+        #on.exit(unmount_docs(self, docs_info), add = TRUE)\n       }\n \n       if (!isTRUE(quiet) && inform_debug && rlang::is_interactive()) {\ndiff --git a/R/ui.R b/R/ui.R\nindex 18e6c2b9d..6fbc2bcd2 100644\n--- a/R/ui.R\n+++ b/R/ui.R\n@@ -111,13 +111,14 @@ mount_openapi <- function(pr, api_url) {\n   }\n   # http://spec.openapis.org/oas/v3.0.3#document-structure\n   # \"It is RECOMMENDED that the root OpenAPI document be named: openapi.json\"\n+  openapi_json_path <- paste0(get_option_or_env(\"plumber.apiPath\", \"\"), \"/openapi.json\")\n   for (ep in pr$endpoints[[\"__no-preempt__\"]]) {\n-    if (ep$path == \"/openapi.json\") {\n+    if (ep$path == openapi_json_path) {\n       message(\"Overwritting existing `/openapi.json` route. Use `$setApiSpec()` to define your OpenAPI Spec\")\n       break\n     }\n   }\n-  pr$handle(\"GET\", \"/openapi.json\", openapi_fun, serializer = serializer_unboxed_json())\n+  pr$handle(\"GET\", openapi_json_path, openapi_fun, serializer = serializer_unboxed_json())\n \n   invisible()\n }\n@@ -125,10 +126,10 @@ mount_openapi <- function(pr, api_url) {\n #' Mount OpenAPI Specification to a plumber router\n #' @noRd\n unmount_openapi <- function(pr) {\n+  path <- get_option_or_env(\"plumber.apiPath\", \"\")\n+  pr$removeHandle(\"GET\", paste0(path, \"/openapi.json\"))\n \n-  pr$removeHandle(\"GET\", \"/openapi.json\")\n   invisible()\n-\n }\n \n #' Add visual documentation for plumber to use\n@@ -184,7 +185,7 @@ register_docs <- function(name, index, static = NULL) {\n   stopifnot(is.function(index))\n   if (!is.null(static)) stopifnot(is.function(static))\n \n-  docs_root <- paste0(\"/__docs__/\")\n+  docs_root <- \"/__docs__/\"\n   docs_paths <- c(\"/index.html\", \"/\")\n   mount_docs_func <- function(pr, api_url, ...) {\n     # Save initial extra argument values\n@@ -211,7 +212,10 @@ register_docs <- function(name, index, static = NULL) {\n       message(\"\")\n     }\n \n-    pr$mount(docs_root, docs_router)\n+    pr$mount(\n+      paste0(get_option_or_env(\"plumber.apiPath\", \"\"), docs_root),\n+      docs_router\n+    )\n \n     # add legacy swagger redirects (RStudio Connect)\n     redirect_info <- swagger_redirects()\n@@ -219,9 +223,6 @@ register_docs <- function(name, index, static = NULL) {\n       if (router_has_route(pr, path, \"GET\")) {\n         message(\"Overwriting existing GET endpoint: \", path, \". Disable by setting `options_plumber(legacyRedirects = FALSE)`\")\n       }\n-      if (router_has_route(pr, redirect_info[[path]]$route, \"GET\")) {\n-        message(\"Overwriting existing GET endpoint: \", redirect_info[[path]]$route, \". Disable by setting `options_plumber(legacyRedirects = FALSE)`\")\n-      }\n       pr_get(pr, path, redirect_info[[path]]$handler)\n     }\n \n@@ -271,9 +272,11 @@ swagger_redirects <- function() {\n       }\n     )\n   }\n+\n+  path <- get_option_or_env(\"plumber.apiPath\", \"\")\n   list(\n-    \"/__swagger__/\" = to_route(\"../__docs__/\"),\n-    \"/__swagger__/index.html\"  = to_route(\"../__docs__/index.html\")\n+    \"/__swagger__/\" = to_route(paste0(path, \"/__docs__/\")),\n+    \"/__swagger__/index.html\"  = to_route(paste0(path, \"/__docs__/index.html\"))\n   )\n }\n "
  },
  "source": {
    "type": "github_pr",
    "repo": "rstudio/plumber",
    "pr_number": 977,
    "pr_url": "https://github.com/rstudio/plumber/pull/977",
    "merged_at": "2025-12-12T20:35:53+00:00",
    "issue_number": null,
    "issue_url": "https://github.com/rstudio/plumber/issues/836"
  },
  "files": {
    "changed": [],
    "source_files": [],
    "test_changes": null
  },
  "quality_score": 8.0,
  "split": "mined",
  "dependencies": [],
  "constraints": {},
  "created_at": "2026-02-22T19:08:53.017607+00:00",
  "updated_at": null
}